{
  "session_name": "test_calibration_session",
  "session_folder": "calibration_data/test_calibration_session",
  "device_ids": [
    "device_1",
    "device_2"
  ],
  "start_time": "2025-08-02T23:59:27.635088",
  "pattern_type": "chessboard",
  "pattern_size": [
    9,
    6
  ],
  "square_size": 25.0,
  "status": "active"
}